김영길,충청남도 남양주시 도산대0가,42279,박남이,주유원,043-729-2500,hongseongmin@example.org,than,10.89.6.128,204.248.19.112,다중 주파수 근본적 구조체,LawnGreen
허현정,인천광역시 종로구 선릉3거리 (서윤김김면),65065,(유) 이고김,재봉사,010-2891-9893,seoyeongi@example.org,geonugim,192.168.103.96,159.186.103.68,중심이 다이나믹 펌웨어,Beige
김주원,서울특별시 동구 양재천77거리 (은정김전면),94512,(주) 박이김,이용사,043-355-0740,gimseonyeong@example.org,hbag,192.168.44.107,13.89.89.254,다중 주파수 로컬 회로,PaleTurquoise
박현지,광주광역시 노원구 영동대길 (정희김읍),28916,김박,배우 및 모델,041-633-3802,seominsu@example.net,fgim,172.17.108.0,30.236.204.93,재정렬 상황에 맞는 능력,LightBlue
김지연,대구광역시 동작구 서초중앙29로,61749,곽심,투자 및 신용 분석가,011-802-8504,jimin64@example.com,anminseo,192.168.58.179,155.5.227.90,숙련된 하이브리드 프레임,Chartreuse
한서준,충청남도 부천시 소사구 양재천길 (정호장리),68221,유한회사 이이최,모피 및 가죽의복 제조원,011-210-0413,hwangseoyeong@example.com,sinhyeonju,10.103.51.164,168.165.149.245,멀티 레이어 교훈적 회로,MidnightBlue
김영미,충청남도 가평군 도산대로,95888,주식회사 문안최,유리제조 및 가공기 조작원,032-879-2754,sangceol70@example.com,coeeunyeong,10.86.26.1,37.200.201.123,업그레이드 가능한 요약 제품,Brown
김하은,경상북도 청양군 삼성11거리,33794,(유) 조,영양사,032-361-7321,baesanghyeon@example.com,bagyeongceol,192.168.23.173,52.64.159.10,업그레이드 가능한 물류 마이그레이션,Navy
김영호,울산광역시 도봉구 압구정로,66393,김안,기타 석유 및 화학물 가공장치 조작원,061-617-8971,yeonghwani@example.com,coeyeweon,192.168.177.36,206.13.177.122,재정렬 역수 고객 만족,Orange
김주원,울산광역시 양천구 강남대가,69651,(유) 박,기타 연극/영화 및 영상 관련 종사자,017-202-3405,nsong@example.org,jojinho,10.82.81.4,197.90.191.132,재정렬 컨텐츠 기반 시간화,MediumPurple
권성호,강원도 용인시 수지구 석촌호수길 (채원이황면),72191,이오고,실내장식 디자이너,033-312-3603,vgo@example.net,sanghun86,192.168.163.86,135.133.16.243,조절 가능한 비대칭 유연성,AntiqueWhite
권민서,울산광역시 도봉구 잠실792로 (현주김면),62796,주식회사 이,사서 및 기록물관리사,044-256-3590,doyunbag@example.com,mgim,172.16.80.54,118.96.197.39,완벽히 설정된 컨텐츠 기반 도전,White
김경수,세종특별자치시 금천구 오금6길,74723,김문이,기타 석유 및 화학물 가공장치 조작원,055-826-7118,si@example.net,gimseonghun,172.28.41.219,207.190.142.211,숙련된 글로벌 설치과정,Gray
박수빈,강원도 괴산군 도산대8로 (경희김백면),61665,(주) 안김이,용접원,041-704-4394,sbag@example.org,ryujeongja,192.168.147.226,214.147.78.85,특별한 고단계 태도,Snow
이정숙,경상북도 충주시 양재천745로,11735,주식회사 이,조사 전문가,070-9107-6685,gyeonghyi16@example.net,bagsumin,10.192.92.164,191.205.44.82,비전 있는 무해한 프레임워크,Silver
김은주,전라북도 이천시 봉은사가,86710,김이,콘크리트공,070-4594-6082,jeongsunan@example.net,eungyeongcoe,10.86.71.135,214.114.154.158,미래가 보장된 휴리스틱 예산 관리,SeaShell
양숙자,광주광역시 서구 도산대25로 (재호송읍),28947,주식회사 박,기타 주방장 및 조리사,062-139-6784,nhan@example.org,gogyeongsug,10.59.160.52,40.5.48.57,조절 가능한 로컬 벤치마크,FireBrick
김은정,인천광역시 영등포구 양재천거리 (미경노박리),55949,김권,음료 제조관련 기계 조작원,055-386-6701,gimjeonghun@example.com,jeongsunjo,172.19.85.27,196.173.247.74,적응된 최대화 그래픽 인터페이스,Tan
김지민,경기도 수원시 가락518거리,01630,김박송,섀시 조립 및 설치원,019-525-4440,bi@example.org,ryujeongsun,172.23.1.10,195.245.148.171,다양한 문맥 기반 계층,DarkOrange
김민서,서울특별시 강북구 강남대675가,61027,(주) 김,상담 전문가 및 청소년 지도사,019-352-3210,seunghyeonbag@example.net,cjang,172.28.176.80,218.63.53.229,효율적인 근본적 유연성,DarkGray
조정숙,제주특별자치도 평택시 개포0가,56041,주식회사 문이한,환경 미화원 및 재활용품 수거원,011-940-2642,pgim@example.com,minsu20,192.168.97.169,71.160.240.89,적응된 24시간 인코딩,DarkOrange
심순자,제주특별자치도 수원시 장안구 개포거리,48813,김최김,생명과학 시험원,010-7685-9350,minseog49@example.net,gimjunseo,192.168.245.143,79.246.40.230,설정 가능한 객체 지향적 웹 사이트,PowderBlue
이도윤,광주광역시 강북구 가락369로 (지연황면),31125,유한회사 송,기타 목재 및 종이 관련 기계조작원,011-867-1822,donghyeoni@example.net,kgim,10.237.238.21,135.22.40.175,숙련된 합성물 모니터링,LemonChiffon
김민준,충청남도 영동군 역삼26거리 (광수노면),35498,주식회사 강류황,네트워크시스템 개발자,070-9914-1866,suminjin@example.com,yeonghwan11,172.20.91.9,111.107.82.45,비전 있는 글로벌 배열,Magenta
김상철,울산광역시 도봉구 강남대536로,32176,주식회사 김이이,외선전공,02-9776-2831,coeyeonggil@example.com,kgim,10.49.200.60,58.41.175.244,진보적인 무관용 함수,DarkGoldenRod
박영길,세종특별자치시 관악구 삼성길 (은지이리),10681,류박,가스/에너지 기술자 및 연구원,033-522-9998,minseoi@example.net,seonyeongjo,10.103.11.40,65.203.93.51,동기화 무해한 하드웨어,White
윤시우,세종특별자치시 강서구 언주45로,88445,유한회사 김지김,임상병리사,043-404-5796,ijeongsig@example.org,yeonghyi59,10.123.249.211,210.156.135.39,리버스 엔지니어링된 그리드 가능 지식 기반,AliceBlue
한하은,전라남도 옥천군 오금가 (정호김오동),50554,박김주,판금기 조작원,017-411-5874,mi@example.net,jihyeonyun,192.168.238.136,187.83.164.129,안정적인 실행 아키텍쳐,YellowGreen
남정숙,경상북도 의왕시 가락42로 (정남이오리),92768,김김박,선박 및 열차 객실승무원,054-674-8026,jiyeong40@example.com,iseongjin,192.168.199.71,217.137.106.167,변경 가능한 헌신적 설치과정,Turquoise
이광수,경상남도 태안군 잠실거리 (성현박리),88490,(유) 김김박,기타 비금속제품관련 생산기 조작원,061-220-5988,gwangsu78@example.net,aheo,192.168.84.125,7.77.147.10,원활한 로컬 프로토콜,DarkSalmon
